company,url,title,location,posted_date,description
Alberta Blue Cross,https://abbluecross.wd3.myworkdayjobs.com/en-US/careers/job/Work-From-Home/Personal-Benefits-Consultant---Inside-Sales-Professional_R720,Personal Benefits Consultant - Inside Sales Professional,"Work From Home, Alberta",Full time,"Alberta Blue Cross® is an Alberta based organization dedicated to delivering exceptional customer experience and community leadership. We’re committed to providing the best health coverage to over 1.8 million members and take an active role in promoting wellness. We believe in what we do—and place trust in our employees to deliver our vision. Working at Alberta Blue Cross® means having a career where you’ll be recognized for your contributions. We value diversity, encourage our employees to maintain a healthy work-life balance and provide opportunities for career growth. Transform your career with Alberta Blue Cross®! We are looking for high performing inside sales professionals to join our progressive and dynamic organization. The goal of our Individual Products division is to be the best sales team in our industry, and we need you. About you: You are a proven sales professional with 3 to 5 years of experience excelling at your role. You embrace sales best practices to allow you to build relationships with customers, solve problems, make quick decisions, and navigate complex situations. You are an excellent communicator who understands the needs of your customers and provides the best advice and solution to meet their needs. You want to be part of an organization that recognizes the value of your contributions to the team and to our customers. You are independent, energetic, and have a strong desire to be successful. You want to be compensated based on your performance and ability to excel at what you do. You want to know that your personal development is a priority for the organization. You want to know that you can pursue your passions and develop your career within the same organization. You want to be part of an organization that recognizes and supports balance, professionally and personally. About us: We are a growing Alberta based organization, with over 1,300 team members, that offers the ability to realize your career aspirations and make a difference for the people we serve. We are the leading provider of health benefits in Alberta with a history of more than 75 years of serving our customers. We believe our team members are the key to making a difference in the lives of our customers and the success of the organization.  As a result, we invest in your personal development to help you be the best you can be at what you do. We offer an industry leading compensation and benefits package, financially competitive, but also focused on helping you realize the quality of life you desire. We support an inclusive workplace with a culture that supports open communication, mutual respect, shared goals, and a commitment to team member growth and development. Responsibilities: Driving Increased Market Share through consistently achieving/exceeding Sales Results . Consistently achieve key performance indicators and metrics. Fostering Client Relationships and an exceptional Customer Experience Utilize strong interpersonal skills to develop rapport and trust with existing and prospective customers via a high volume of inbound/outbound calls and follow up. Develop customer insight to align the appropriate solution to best serve the needs of the customer. Develop a strong corporate and personal brand through demonstrating integrity, following up, and delivering on customer commitments. Execute all required administrative requirements to create and process contracts. Strong Cross Functional Collaboration and Teamwork Work closely with internal stakeholders to deliver the ultimate experience for our customers. Collaborate and pro-actively engage with leadership and peers to execute on sales and customer expectation. Continuous Learning and Professional Development Engage with leadership in weekly coaching sessions to further develop skills and competencies. Secure the applicable industry licensing, A&S and Life as part of the onboarding process. Proactively create and execute a personal development plan through discussions with leaders. Professional Sales Conduct Consistently meet customer commitments and follow up requirements. Work closely with leaders, peers and supporting stakeholders to deliver on our strategic vision. Act in the best interests of our organization, customers, and community. Work from home Monday to Friday, 8:30 – 5:00 pm. Advantages You will receive a best-in-class compensation plan, including base salary, variable pay based on performance with the ability to make significant earnings. An exceptional President’s Club program that recognizes our high performers excelling in their role. You will enjoy a competitive benefits program inclusive of a defined benefit pension plan, ability to participate in an earned day off program, and additional time off over the winter holiday season. ​ This position will remain open until a suitable candidate is selected. Alberta Blue Cross® is an inclusive employer committed to a workplace that reflects the diversity of the communities we serve. We empower and are advocates for our employees by welcoming, respecting and valuing their unique perspectives, backgrounds, and experiences. We offer a competitive salary and benefits package and the opportunity to work in an innovative, high-energy team-focused environment. If you have the qualifications we are looking for, please apply."
Alberta Blue Cross,https://abbluecross.wd3.myworkdayjobs.com/en-US/careers/job/Work-From-Home/System-Analyst--Enterprise-Servers---Storage-ESS----Information-Technology_R724,"System Analyst, Enterprise Servers & Storage (ESS) – Information Technology","Work From Home, Alberta",Full time,"Alberta Blue Cross® is an Alberta based organization dedicated to delivering exceptional customer experience and community leadership. We’re committed to providing the best health coverage to over 1.8 million members and take an active role in promoting wellness. We believe in what we do—and place trust in our employees to deliver our vision. Working at Alberta Blue Cross® means having a career where you’ll be recognized for your contributions. We value diversity, encourage our employees to maintain a healthy work-life balance and provide opportunities for career growth. OVERVIEW: Alberta Blue Cross ® has an opportunity for a System Analyst - Enterprise Server and Storage. You will be joining a team responsible for the planning, implementation, management, and monitoring of highly secure and resilient server, data storage, data backup, and virtualization environments, including both on-premise and cloud hosted technologies. This team plays a key role in supporting Windows and Linux server environments, as well as infrastructure systems based on Microsoft, VMware, Red Hat and Dell platforms. Our ideal candidate has very strong technical abilities, has a solid foundation of experience in systems administration, and is highly skilled at scripting, automation, securing systems and solving complex problems. This is a work from home position and reports to the Team Manager of Enterprise Server and Storage in the IT Infrastructure and Operations Department. WHAT YOU WILL DO: Administer and support Microsoft and/or Linux based enterprise and cloud applications. Have the opportunity be a subject matter expert specializing in Microsoft Azure and Office 365 technologies, as well as Windows, Linux, virtualization, storage, and backups. You will be encouraged to both develop specialized skills as well as continue to expand breadth of knowledge and versatility over time. Maintain highly reliable, stable, resilient, and secure server and storage infrastructure environments, with focus on continuous improvement and ongoing enhancements. Provide technical expertise in support of complex infrastructure working closely with customers and vendors to resolve technical issues. Engage vendors as required to expedite resolutions. Develop methods to streamline and automate the deployment, installation, and administration of supported systems. Continuously enhance the security our systems using industry best practices for patching and hardening supported systems. Provide input and ideas into the planning and delivery of technical solutions for new technology deployment and corporate projects. Create and update documentation including standard operating procedures, knowledge base articles and project documentation. Participate in a rotational, 24x7 on-call production support cycle. The successful candidate will be required to successfully complete a personnel security screening and obtain a security clearance. WHAT YOU WILL HAVE: A diploma or degree in a related technical discipline from a recognized institute. 5+ years of experience in an enterprise IT environment. Previous experience administering Azure technologies. Experience with multiple cloud vendors (AWS, GCP, etc.) is a bonus. A solid understanding of Azure services and architecture. Strong scripting and automation experience. PowerShell, Ansible, and Terraform are desirable. Advanced knowledge of one or more of the following technologies: Microsoft Active Directory, and Microsoft Windows server technologies. Microsoft Exchange and Teams. Red Hat Enterprise Linux (RHEL); equivalencies will be considered. VMWare vSphere Strong problem solving skills and the ability to troubleshoot complex issues. A keen interest in technology with a passion for continuous learning and growth. Excellent communication and teamwork skills. Self-motivated and detail oriented. Effective at planning, organization, and time management. A positive attitude and a desire to build strong effective working relationships in a collaborative team environment demonstrating a service orientated mindset and strong interpersonal skills. A very high level of accountability and a demonstrated ability to be both reliable and dependable. Have a strong aptitude for process improvement and a desire to keep current with technology. Ability to be versatile and highly adaptable to respond to changing business priorities. This position will remain open until a suitable candidate is selected. Alberta Blue Cross® is an inclusive employer committed to a workplace that reflects the diversity of the communities we serve. We empower and are advocates for our employees by welcoming, respecting and valuing their unique perspectives, backgrounds, and experiences. We offer a competitive salary and benefits package and the opportunity to work in an innovative, high-energy team-focused environment. If you have the qualifications we are looking for, please apply."
Alberta Blue Cross,https://abbluecross.wd3.myworkdayjobs.com/en-US/careers/job/Hybrid/UX-Writer---Digital-Experience_R721,UX Writer – Digital Experience,"Hybrid, Edmonton",Full time,"Alberta Blue Cross® is an Alberta based organization dedicated to delivering exceptional customer experience and community leadership. We’re committed to providing the best health coverage to over 1.8 million members and take an active role in promoting wellness. We believe in what we do—and place trust in our employees to deliver our vision. Working at Alberta Blue Cross® means having a career where you’ll be recognized for your contributions. We value diversity, encourage our employees to maintain a healthy work-life balance and provide opportunities for career growth. OVERVIEW: We have big plans and an even bigger vision at Alberta Blue Cross® to deliver an exceptional digital experience for everyone. We are looking for a UX writer to join us on our mission to design universal, efficient, and enjoyable experiences. The ideal candidate for this position will highly creative, tech-savvy and strongly focused on understanding how our users think, speak, feel and behave to identify language that is natural and useful. You recognize how content shapes platforms and how the words you choose is the difference between an empowered user and an abandonment. You will have a deep passion to help our users solve their problems. You are a natural storyteller and have an editing superpower that supports Alberta Blue Cross’® digital experience goals. In return, you’ll be part of a high-performing, ambitious and truly user-centric team that brings compassion, humanity and clarity to our digital platforms. You will have the flexibility to decide how and when you work. While you may be working from home most of the time, there will be plenty of opportunity to come into the office periodically for important meetings, team events and other purposeful connections. WHO YOU ARE: Passionate about the power of the written word. Advocate for plain language, clarity and brevity. Committed to seeking out and providing constructive feedback. Dedicated to delivering the ultimate user experience. Endlessly curious, challenging the status-quo and always asking questions. Self-driven and self-motivated learner who explores emerging trends, tools and technologies. Loves Embraces change and can bring clarity to any situation. Not afraid to ask for help, fail or try again. A critical thinker with strong problem-solving skills and independent self-direction. Have an aptitude for team collaboration and open communication. WHAT YOU WILL DO: Create simple, accessible, approachable, modern, and conversational content that enables customers to self-serve and improve their understanding of the topic or task at hand. Combine your domain expertise with stakeholder interviews, business requirements, competitive research, user research and analytical data. Effectively navigate complex systems and regulatory environments and distill the concepts to any audience. Participate in design sprints and planning sessions to uncover the core concepts, customer language and top questions you need to support in the user experience. Facilitate co-writing sessions and collaborate with stakeholders to deliver compelling UX solutions. Conduct content research to inform terminology, wayfinding, content density, structure and sequencing, and understand customer mental models. Define the role of content in user journeys across rapidly evolving digital platforms. Develop guides for new users that adhere to established help and documentation heuristics. Identify opportunities for content additions, improvements and innovations based on feedback, and qualitative and quantitative analytics. Perform functional and editorial quality assurance on all digital content. Effectively pitch ideas to the team and stakeholders. Create and maintain design system content guides, taxonomies, pervasive architecture, metadata frameworks, content migration plans and content performance goals. Maintain a knowledge base of UX writing standards that contribute to the digital experience practice and design system. WHAT YOU WILL HAVE: Minimum of 3 to 5 years’ working experience and progressive responsibilities writing for digital platforms. A portfolio of UX-focused writing samples and style guidelines. Experience on user-focused product writing including work in hardware, software, digital agency or other relevant product area. Experience in shaping content for multi-disciplinary projects. Experience leading large, complex content strategies for user experiences, from notifications to structuring content in the UI. Experience creating word lists and style guidelines. Excellent written and oral communication skills. Strong organizational, and time management skills. Ability to task switch while maintaining attention to detail. Flexibility to adapt to rapidly evolving environments, competing priorities and changing requirements. Demonstrated aptitude to learn new things and desire to stay on top of industry trends, the competitive landscape and top news. Proven conflict resolution and negotiation skills. Bachelor's degree in English, Communications, Journalism, Technical Writing, UX, Human-Computer Interaction, or equivalent practical experience. Proficiency in Adobe XD and Figma is considered an asset. Basic knowledge of HTML and CSS is considered an asset. WHAT WE OFFER: Support a healthy work-life balance. Invest in your growth and expertise. Provide opportunities mentorship from across the organization. Be part of maturing our user experience practice. This position will remain open until a suitable candidate is selected. Alberta Blue Cross® is an inclusive employer committed to a workplace that reflects the diversity of the communities we serve. We empower and are advocates for our employees by welcoming, respecting and valuing their unique perspectives, backgrounds, and experiences. We offer a competitive salary and benefits package and the opportunity to work in an innovative, high-energy team-focused environment. If you have the qualifications we are looking for, please apply."
Alberta Blue Cross,https://abbluecross.wd3.myworkdayjobs.com/en-US/careers/job/Hybrid/Team-Manager---Network---Telecommunications---Information-Technology_R706,"Team Manager, Network & Telecommunications – Information Technology","Hybrid, Edmonton",Full time,"Alberta Blue Cross® is an Alberta based organization dedicated to delivering exceptional customer experience and community leadership. We’re committed to providing the best health coverage to over 1.8 million members and take an active role in promoting wellness. We believe in what we do—and place trust in our employees to deliver our vision. Working at Alberta Blue Cross® means having a career where you’ll be recognized for your contributions. We value diversity, encourage our employees to maintain a healthy work-life balance and provide opportunities for career growth. OVERVIEW: Are you a natural leader with a knack for inspiring technical teams? Are you able to create dynamic team environments that are both productive and positive? At Alberta Blue Cross®, we are committed to providing the best health coverage for our members and take an active role in promoting the wellness of all Albertans.  We believe in what we do and place trust in our employees to deliver our vision. Working in a mobile workstyle and under the leadership of the Manager of Network & Server Infrastructure, the Team Manager will be responsible to lead a high-performing technical team to deliver exceptional customer service and best-in-class infrastructure support across the organization. Note: The successful candidate will be required to successfully complete a personnel security screening as a Federal B clearance is required. WHAT YOU WILL DO: Lead and support a team of technical analysts in the areas of network, telecommunications, and security infrastructure. Foster a positive work culture that inspires high productivity and supportive, cohesive teamwork, creating an enjoyable atmosphere for team members to do their best work. Build and maintain effective and trusted relationships with customers, peers, and vendors. Manage the delivery of effective resolutions when concerns or issues arise from within the team, business and support areas, or external clients. Develop work plans to support corporate projects, departmental initiatives, and day-to-day operations. Champion continuous improvement and operational excellence across the entire portfolio. Communicate effectively with all levels of the organization on a regular basis. Ensure the team is delivering highly valued and trusted services to our customers. Demonstrate commitment to team member development with regular performance discussions, supporting training opportunities, and identifying areas for growth. Participate in an on-call 24x7 rotation for major incident management, including the potential for on-site datacenter support. The successful candidate will be required to successfully complete a personnel security screening. WHAT YOU WILL HAVE: A bachelor’s degree or diploma in Computer Science or related technical discipline is required. A minimum of five years working within the IT industry or demonstrated experience working within an industry closely related to technology is required. A minimum of three years of direct leadership experience managing technical teams is required, including HR responsibilities. Ability to lead teams with expertise in highly specialized technical areas for which you may not have a high degree of previous experience. Demonstrated strength in planning, organizing, and managing work, including delegation Decision-making confidence, critical thinking, and problem-solving skills. Excellent interpersonal skills, both written and verbal, to convey pertinent information to both technical and non-technical audiences. A high degree of self-awareness, emotional intelligence, and an understanding of what factors can impact both people and business. Commitment to providing an outstanding customer experience to internal and external customers, showcasing exceptional care, attention to detail, professionalism, and respect. This position will remain open until a suitable candidate is selected. Alberta Blue Cross® is an inclusive employer committed to a workplace that reflects the diversity of the communities we serve. We empower and are advocates for our employees by welcoming, respecting and valuing their unique perspectives, backgrounds, and experiences. We offer a competitive salary and benefits package and the opportunity to work in an innovative, high-energy team-focused environment. If you have the qualifications we are looking for, please apply."
