company,url,title,location,posted_date,description
BDO Canada ,https://bdo.wd3.myworkdayjobs.com/en-US/BDO/job/Ottawa---Kent-St/Administrative-Professional_JR4260,Administrative Professional,"Ottawa - Kent St, Toronto - Bay St",Full time,"Putting people first, every day BDO is a firm built on a foundation of positive relationships with our people and our clients. Each day, our professionals provide exceptional service, helping clients with advice and insight they can trust. In turn, we offer an award-winning environment that fosters a people-first culture with a high priority on your personal and professional growth. Your Opportunity BDO Canada is seeking an Administrative Professional to support the Executive team by owning the below job responsibilities: Key Accountabilities and Responsibilities General Administrative duties include but are not limited to: typing various communication & documentation correspondence, document storage, sending invoices Coordinate details related to internal meetings, including set-up and catering Assist with client invoices, entering data into databases, and completing risk checks Assist workflow software/systems including tracking and reporting Assist with partner expense reports Provide ongoing administrative support to the team including, formatting documents, formatting presentations, proofreading, meeting minutes and additional documentation and correspondence Provide administrative support to multiple Executive Assistants and staff on the team Client interaction to support information requests and follow-ups Gain knowledge about the Public sector Perform other duties as assigned How do we define success for your role? You demonstrate BDO's core values through all aspects of your work: Integrity, Respect and Collaboration You understand our client’s industry, challenges, and opportunities; clients describe you as positive, professional, and delivering high quality work You identify, recommend, and are focused on effective service delivery to our clients You share in an inclusive and engaging work environment that develops, retains and attracts talent You actively participate in the adoption of digital tools and strategies to drive an innovative workplace You grow your expertise through learning and professional development Education and Professional Skills/Knowledge You have 1+ years of working experience in an administrative or similar role You have an Office Administration diploma or other relevant education an asset Prior working experience at a professional services firm an asset You have good knowledge of Microsoft Office computer programs (Word, Excel, and Outlook) and can learn new digital tools quickly You have the ability to prioritize workload and the flexibility to manage multiple tasks You are able to work quickly and take on more responsibilities over time You have the ability to work in a deadline-driven work setting and deal with confidential information You have strong problem solving, analytical, and communication skills both written and oral You value teamwork, client service, and quality in detailed work You have excellent written and oral communication Why BDO? Our people-first approach to talent has earned us a spot among Canada’s Top 100 Employers for 2025 . This recognition is a milestone we’re thrilled to add to our collection of awards for both experienced and student talent experiences. Our firm is committed to providing an environment where you can be successful in the following ways: We enable you to engage with how we change and evolve, being a key contributor to the success and growth of BDO in Canada. We help you become a better professional within our services, industries, and markets with extensive opportunities for learning and development. We support your achievement of personal goals outside of the office and making an impact on your community. Giving back adds up: Where company meets community. BDO is actively involved in our communities by supporting local charity initiatives. We support staff with local and national events where you will be given the opportunity to contribute to your community. Total rewards that matter: We pay for performance with competitive total cash compensation that recognizes and rewards your contribution. We provide flexible benefits from day one, and a market leading personal time off policy. We are committed to supporting your overall wellness beyond working hours and provide reimbursement for wellness initiatives that fit your lifestyle. Everyone counts: We believe every employee should have the opportunity to participate and succeed. Through leadership by our Diversity, Equity and Inclusion Leader, we are committed to a workplace culture of respect, inclusion, and diversity. We recognize and celebrate the valuable differences among each of us, including race, religious beliefs, physical or mental disabilities, age, place of origin, marital status, family status, gender or gender identity and sexual orientation. If you require accommodation to complete the application process, please contact us . Flexibility: All BDO personnel are expected to spend some of their time working in the office, at the client site, and virtually unless accommodations or alternative work arrangements are in place. Our model is a blended approach designed to support the flexible needs of our people, the firm and our clients. It’s about creating work experiences that meet everyone’s needs and providing flexibility to adjust when, where and how we work to meet the expectations of our role. Code of Conduct: Our Code of Conduct sets clear standards for how we conduct business. It reflects our shared values and commitments and includes guiding principles to help us make ethical decisions and maintain trust with each other, our clients, and the public. Ready to make your mark at BDO? Click “Apply now” to send your up-to-date resume to one of our Talent Acquisition Specialists. To explore other opportunities at BDO, check out our careers page ."
BDO Canada ,https://bdo.wd3.myworkdayjobs.com/en-US/BDO/job/Vancouver/Senior-Bilingual-Talent-Acquisition-Specialist_JR4259,Senior Bilingual Talent Acquisition Specialist,Vancouver,Full time,"Putting people first, every day BDO is a firm built on a foundation of positive relationships with our people and our clients. Each day, our professionals provide exceptional service, helping clients with advice and insight they can trust. In turn, we offer an award-winning environment that fosters a people-first culture with a high priority on your personal and professional growth. Your Opportunity We are actively seeking a Senior Bilingual Talent Acquisition Specialist to play a key role in supporting the growth of our assurance, tax and accounting service lines. As a trusted advisor to business leaders, you will drive strategic talent initiatives, enhance recruitment processes, and build a strong talent pipeline. This role offers flexibility to work from any of our offices across Canada. Drive strategic sourcing and recruitment initiatives to attract top-tier talent for assigned client groups, which may include Accounting, Tax, or Assurance service lines, leveraging a business partnership approach to define evolving talent needs. Develop and implement data-driven sourcing strategies, utilizing analytics, market intelligence, and competitive insights to proactively identify and engage high-caliber candidates. Establish and nurture strong external relationships with industry professionals, networks, and associations to strengthen the firm’s talent pipeline and employer brand. Act as a trusted advisor to business leaders, providing proactive consultation on talent acquisition strategies that align with short- and long-term business objectives. Collaborate closely with senior leadership and hiring managers to refine role specifications, incorporating market trends and data on in-demand skills to enhance decision-making. Elevate the firm's employer brand by serving as a brand ambassador, effectively communicating our employee value proposition to attract and retain top talent. Optimize recruitment processes and tools, ensuring efficiency, scalability, and alignment with best practices in talent acquisition. Demonstrate business acumen by aligning recruitment efforts with the firm's financial and strategic growth objectives, directly contributing to performance and profitability. How do we define success for your role? You demonstrate BDO's core values through all aspect of your work: Integrity, Respect and Collaboration You understand your client’s industry, challenges, and opportunities; clients describe you as positive, professional, and delivering high-quality work You identify, recommend, and are focused on effective service delivery to your clients You share in an inclusive and engaging work environment that develops, retains & attracts talent You actively participate in the adoption of digital tools and strategies to drive an innovative workplace You grow your expertise through learning and professional development. Your experience and education You offer at least 5 years of experience in talent acquisition, with a focus on strategic recruitment, sourcing and talent advisory. Corporate or professional services environment is preferred. You are bilingual in English and French (both written and verbal). This role requires frequent communication with client groups, candidates, colleagues and other stakeholders across Canada, including the province of Quebec. You bring advanced analytical and problem-solving skills. You showcase exceptional strategic sourcing capabilities. You offer strong collaboration and communication skills, allowing you to effectively partner with various stakeholders across the firm. You are a proficient user of applicant tracking systems such as Workday Recruiter, and other recruitment tools. You are passionate and experienced in leveraging AI-driven recruitment technologies and automation tools. Salary Range: $73,000 to $111,000 Why BDO? Our people-first approach to talent has earned us a spot among Canada’s Top 100 Employers for 2025 . This recognition is a milestone we’re thrilled to add to our collection of awards for both experienced and student talent experiences. Our firm is committed to providing an environment where you can be successful in the following ways: We enable you to engage with how we change and evolve, being a key contributor to the success and growth of BDO in Canada. We help you become a better professional within our services, industries, and markets with extensive opportunities for learning and development. We support your achievement of personal goals outside of the office and making an impact on your community. Giving back adds up: Where company meets community. BDO is actively involved in our communities by supporting local charity initiatives. We support staff with local and national events where you will be given the opportunity to contribute to your community. Total rewards that matter: We pay for performance with competitive total cash compensation that recognizes and rewards your contribution. We provide flexible benefits from day one, and a market leading personal time off policy. We are committed to supporting your overall wellness beyond working hours and provide reimbursement for wellness initiatives that fit your lifestyle. Everyone counts: We believe every employee should have the opportunity to participate and succeed. Through leadership by our Diversity, Equity and Inclusion Leader , we are committed to a workplace culture of respect, inclusion, and diversity. We recognize and celebrate the valuable differences among each of us, including race, religious beliefs, physical or mental disabilities, age, place of origin, marital status, family status, gender or gender identity and sexual orientation. If you require accommodation to complete the application process, please contact us . Flexibility: All BDO personnel are expected to spend some of their time working in the office, at the client site, and virtually unless accommodations or alternative work arrangements are in place. Our model is a blended approach designed to support the flexible needs of our people, the firm and our clients. It’s about creating work experiences that meet everyone’s needs and providing flexibility to adjust when, where and how we work to meet the expectations of our role. Code of Conduct : Our Code of Conduct sets clear standards for how we conduct business. It reflects our shared values and commitments and includes guiding principles to help us make ethical decisions and maintain trust with each other, our clients, and the public. Ready to make your mark at BDO? Click “Apply now” to send your up-to-date resume to one of our Talent Acquisition Specialists. To explore other opportunities at BDO, check out our careers page . #LI-ES1"
BDO Canada ,https://bdo.wd3.myworkdayjobs.com/en-US/BDO/job/Toronto---Bay-St/Senior-Bilingual-Talent-Acquisition-Specialist_JR4258,Senior Bilingual Talent Acquisition Specialist,"Toronto - Bay St, Calgary - 8th Ave SW, Halifax - Mumford Rd, Montreal - 1000 Rue De La Gauchetière Ouest, Ottawa - Kent St",Full time,"Putting people first, every day BDO is a firm built on a foundation of positive relationships with our people and our clients. Each day, our professionals provide exceptional service, helping clients with advice and insight they can trust. In turn, we offer an award-winning environment that fosters a people-first culture with a high priority on your personal and professional growth. Your Opportunity We are actively seeking a Senior Bilingual Talent Acquisition Specialist to play a key role in supporting the growth of our assurance, tax and accounting service lines. As a trusted advisor to business leaders, you will drive strategic talent initiatives, enhance recruitment processes, and build a strong talent pipeline. This role offers flexibility to work from any of our offices across Canada. Drive strategic sourcing and recruitment initiatives to attract top-tier talent for assigned client groups, which may include Accounting, Tax, or Assurance service lines, leveraging a business partnership approach to define evolving talent needs. Develop and implement data-driven sourcing strategies, utilizing analytics, market intelligence, and competitive insights to proactively identify and engage high-caliber candidates. Establish and nurture strong external relationships with industry professionals, networks, and associations to strengthen the firm’s talent pipeline and employer brand. Act as a trusted advisor to business leaders, providing proactive consultation on talent acquisition strategies that align with short- and long-term business objectives. Collaborate closely with senior leadership and hiring managers to refine role specifications, incorporating market trends and data on in-demand skills to enhance decision-making. Elevate the firm's employer brand by serving as a brand ambassador, effectively communicating our employee value proposition to attract and retain top talent. Optimize recruitment processes and tools, ensuring efficiency, scalability, and alignment with best practices in talent acquisition. Demonstrate business acumen by aligning recruitment efforts with the firm's financial and strategic growth objectives, directly contributing to performance and profitability. How do we define success for your role? You demonstrate BDO's core values through all aspect of your work: Integrity, Respect and Collaboration You understand your client’s industry, challenges, and opportunities; clients describe you as positive, professional, and delivering high-quality work You identify, recommend, and are focused on effective service delivery to your clients You share in an inclusive and engaging work environment that develops, retains & attracts talent You actively participate in the adoption of digital tools and strategies to drive an innovative workplace You grow your expertise through learning and professional development. Your experience and education You offer at least 5 years of experience in talent acquisition, with a focus on strategic recruitment, sourcing and talent advisory. Corporate or professional services environment is preferred. You are bilingual in English and French (both written and verbal). This role requires frequent communication with client groups, candidates, colleagues and other stakeholders across Canada, including the province of Quebec. You bring advanced analytical and problem-solving skills. You showcase exceptional strategic sourcing capabilities. You offer strong collaboration and communication skills, allowing you to effectively partner with various stakeholders across the firm. You are a proficient user of applicant tracking systems such as Workday Recruiter, and other recruitment tools. You are passionate and experienced in leveraging AI-driven recruitment technologies and automation tools. Why BDO? Our people-first approach to talent has earned us a spot among Canada’s Top 100 Employers for 2025 . This recognition is a milestone we’re thrilled to add to our collection of awards for both experienced and student talent experiences. Our firm is committed to providing an environment where you can be successful in the following ways: We enable you to engage with how we change and evolve, being a key contributor to the success and growth of BDO in Canada. We help you become a better professional within our services, industries, and markets with extensive opportunities for learning and development. We support your achievement of personal goals outside of the office and making an impact on your community. Giving back adds up: Where company meets community. BDO is actively involved in our communities by supporting local charity initiatives. We support staff with local and national events where you will be given the opportunity to contribute to your community. Total rewards that matter: We pay for performance with competitive total cash compensation that recognizes and rewards your contribution. We provide flexible benefits from day one, and a market leading personal time off policy. We are committed to supporting your overall wellness beyond working hours and provide reimbursement for wellness initiatives that fit your lifestyle. Everyone counts: We believe every employee should have the opportunity to participate and succeed. Through leadership by our Diversity, Equity and Inclusion Leader , we are committed to a workplace culture of respect, inclusion, and diversity. We recognize and celebrate the valuable differences among each of us, including race, religious beliefs, physical or mental disabilities, age, place of origin, marital status, family status, gender or gender identity and sexual orientation. If you require accommodation to complete the application process, please contact us . Flexibility: All BDO personnel are expected to spend some of their time working in the office, at the client site, and virtually unless accommodations or alternative work arrangements are in place. Our model is a blended approach designed to support the flexible needs of our people, the firm and our clients. It’s about creating work experiences that meet everyone’s needs and providing flexibility to adjust when, where and how we work to meet the expectations of our role. Code of Conduct : Our Code of Conduct sets clear standards for how we conduct business. It reflects our shared values and commitments and includes guiding principles to help us make ethical decisions and maintain trust with each other, our clients, and the public. Ready to make your mark at BDO? Click “Apply now” to send your up-to-date resume to one of our Talent Acquisition Specialists. To explore other opportunities at BDO, check out our careers page . #LI-ES1"
BDO Canada ,https://bdo.wd3.myworkdayjobs.com/en-US/BDO/job/Toronto---Bay-St/Co-op-or-Intern--Technology-Risk-Assurance--May-2025-_JR4257,"Co-op or Intern, Technology Risk Assurance (May 2025)",Toronto - Bay St,Full time,"Putting people first, every day BDO is a firm built on a foundation of positive relationships with our people and our clients. Each day, our professionals provide exceptional service, helping clients with advice and insight they can trust. In turn, we offer an award-winning environment that fosters a people-first culture with a high priority on your personal and professional growth. Your Opportunity Our Technology Risk Assurance team is looking for Co-op or Intern Students to join in May 2025 for either a 4 or 8 month term and own the following responsibilities: Support engagement teams through assessments of IT General Controls for financial statement audits and assist in preparing complete and accurate working papers. Develop a variety of client deliverables, including risk assessments, analyses, recommendations, and reporting documentation. Collaborate with engagement teams to establish timelines and deliver high quality client service. Assist the team with business development proposals on existing and new clients. Maintain a proactive and logical approach to information gathering and present complex ideas through clear communications. Build positive working relationships with clients and suggest improvements for future assignments. How do we define success for your role? You demonstrate BDO's core values through all aspects of your work: Integrity, Respect & Collaboration. You identify, recommend & are focused on providing effective and efficient support to the engagement team. You share in an inclusive & engaging work environment that develops, retains & attracts talent. You actively participate in the adoption of digital tools and strategies to drive an innovative workplace. You grow your expertise through learning & professional development. Your experience and education You are currently working towards a degree/diploma in Accounting, Business, Mathematics, IT security or Cyber Security. You are planning to work towards CPA Canada’s Chartered Professional Accountant designation; and/or are planning to work towards ISACA’s Certified Information Systems Auditor (CISA) designation long term. You describe yourself as tech-savvy and analytical, bringing a creative mindset to the team and sharing new ideas for improved efficiencies. Past co-op, internship, or relevant work or project experience particularly in a professional services or accounting environment would be considered an asset. You have a desire to provide outstanding client service and a commitment to teamwork. You excel at problem solving, analytical thinking, and communication skills. Fluency in both English and French is an asset. Why BDO? Our people-first approach to talent has earned us a spot among Canada’s Top 100 Employers for 2025 . This recognition is a milestone we’re thrilled to add to our collection of awards for both experienced and student talent experiences. Our firm is committed to providing an environment where you can be successful in the following ways: We enable you to engage with how we change and evolve, being a key contributor to the success and growth of BDO in Canada. We help you become a better professional within our services, industries, and markets with extensive opportunities for learning and development. We support your achievement of personal goals outside of the office and making an impact on your community. Giving back adds up: Where company meets community. BDO is actively involved in our communities by supporting local charity initiatives. We support staff with local and national events where you will be given the opportunity to contribute to your community. Total rewards that matter: We pay for performance with competitive total cash compensation that recognizes and rewards your contribution. We provide flexible benefits from day one, and a market leading personal time off policy. We are committed to supporting your overall wellness beyond working hours and provide reimbursement for wellness initiatives that fit your lifestyle. Everyone counts: We believe every employee should have the opportunity to participate and succeed. Through leadership by our Diversity, Equity and Inclusion Leader, we are committed to a workplace culture of respect, inclusion, and diversity. We recognize and celebrate the valuable differences among each of us, including race, religious beliefs, physical or mental disabilities, age, place of origin, marital status, family status, gender or gender identity and sexual orientation. If you require accommodation to complete the application process, please contact us . Flexibility: All BDO personnel are expected to spend some of their time working in the office, at the client site, and virtually unless accommodations or alternative work arrangements are in place. Our model is a blended approach designed to support the flexible needs of our people, the firm and our clients. It’s about creating work experiences that meet everyone’s needs and providing flexibility to adjust when, where and how we work to meet the expectations of our role. Code of Conduct: Our Code of Conduct sets clear standards for how we conduct business. It reflects our shared values and commitments and includes guiding principles to help us make ethical decisions and maintain trust with each other, our clients, and the public. Ready to make your mark at BDO? Click “Apply now” to send your up-to-date resume to one of our Talent Acquisition Specialists. To explore other opportunities at BDO, check out our careers page ."
