company,url,title,location,posted_date,description
BDO Canada ,https://bdo.wd3.myworkdayjobs.com/en-US/BDO/job/Calgary----Marlborough-Mall-Way-NE/Insolvency-Advisor--Personal-Debt-Solutions_JR4245,"Insolvency Advisor, Personal Debt Solutions",Calgary -  Marlborough Mall Way NE,Full time,"Putting people first, every day BDO is a firm built on a foundation of positive relationships with our people and our clients. Each day, our professionals provide exceptional service, helping clients with advice and insight they can trust. In turn, we offer an award-winning environment that fosters a people-first culture with a high priority on your personal and professional growth. Your Opportunity Our BDO Calgary BDO office is looking for an Insolvency Advisor to join the Personal Debt Solution team. This position entails maintaining an in-office presence by completing the following duties: Perform initial consultations to assess the debtor’s situation and recommend appropriate options, training will be provided Assist debtors and creditors, both in person and by telephone, as it relates to bankruptcies and proposals Review interview forms, and prepare files/documents for client signing Community outreach, business development, presentations, and use of social media to promote personal debt solutions offerings. How do we define success for your role? You demonstrate BDO's core values through all aspects of your work: Integrity, Respect and Collaboration You understand your client’s needs , challenges, and opportunities; client s describe you as positive, professional, and empathetic You identify, recommend, and are focused on effective service delivery to your clients You share in an inclusive and engaging work environment that develops, retains & attracts talent You actively participate in the adoption of digital tools and strategies to drive an innovative workplace You grow your expertise through learning and professional development. Your experience and education 2+ years in customer service, financial services insolvency, banking, credit counseling, or other relevant areas of interpersonal skills with the ability to collaborate with team members, debtors, and creditors Demonstrated ability to communicate effectively in various situations Strong attention to detail in a fast-paced environment Takes personal ownership and responsibility for the quality and timeliness of work Proficient in Microsoft Outlook, Word & Excel Excellent time management and organizational skills A team player who can also work independently Previous insolvency experience (asset but not required) Available to work one evening shift a week until 7:30 pm Why BDO? Our people-first approach to talent has earned us a spot among Canada’s Top 100 Employers for 2025 . This recognition is a milestone we’re thrilled to add to our collection of awards for both experienced and student talent experiences. Our firm is committed to providing an environment where you can be successful in the following ways: We enable you to engage with how we change and evolve, being a key contributor to the success and growth of BDO in Canada. We help you become a better professional within our services, industries, and markets with extensive opportunities for learning and development. We support your achievement of personal goals outside of the office and making an impact on your community. Giving back adds up: Where company meets community. BDO is actively involved in our communities by supporting local charity initiatives. We support staff with local and national events where you will be given the opportunity to contribute to your community. Total rewards that matter: We pay for performance with competitive total cash compensation that recognizes and rewards your contribution. We provide flexible benefits from day one, and a market leading personal time off policy. We are committed to supporting your overall wellness beyond working hours and provide reimbursement for wellness initiatives that fit your lifestyle. Everyone counts: We believe every employee should have the opportunity to participate and succeed. Through leadership by our Diversity, Equity and Inclusion Leader, we are committed to a workplace culture of respect, inclusion, and diversity. We recognize and celebrate the valuable differences among each of us, including race, religious beliefs, physical or mental disabilities, age, place of origin, marital status, family status, gender or gender identity and sexual orientation. If you require accommodation to complete the application process, please contact us . Flexibility: All BDO personnel are expected to spend some of their time working in the office, at the client site, and virtually unless accommodations or alternative work arrangements are in place. Our model is a blended approach designed to support the flexible needs of our people, the firm and our clients. It’s about creating work experiences that meet everyone’s needs and providing flexibility to adjust when, where and how we work to meet the expectations of our role. Code of Conduct: Our Code of Conduct sets clear standards for how we conduct business. It reflects our shared values and commitments and includes guiding principles to help us make ethical decisions and maintain trust with each other, our clients, and the public. Ready to make your mark at BDO? Click “Apply now” to send your up-to-date resume to one of our Talent Acquisition Specialists. To explore other opportunities at BDO, check out our careers page ."
BDO Canada ,https://bdo.wd3.myworkdayjobs.com/en-US/BDO/job/Montreal---1000-Rue-De-La-Gauchetire-Ouest/Intermediate-Associate--Cloud-Accounting-Services_JR4104,"Intermediate Associate, Cloud Accounting Services",Montreal - 1000 Rue De La Gauchetière Ouest,Full time,"Putting people first, every day BDO is a firm built on a foundation of positive relationships with our people and our clients. Each day, our professionals provide exceptional service, helping clients with advice and insight they can trust. In turn, we offer an award-winning environment that fosters a people-first culture with a high priority on your personal and professional growth. Your Opportunity Our Montreal office is looking for a bilingual Intermediate Associate to join the Cloud Accounting Services team and own the following responsibilities: Provide full cycle accounting and bookkeeping services in a cloud-based environment Perform reconciliations of bank accounts, journal entries, as well as handle accounts payable and accounts receivable Preparation of regular external filings, such as HST completion of routine account analysis and bookkeeping assignments following established procedures Preparation of month end reporting packages, financial statements and related information Responding to queries and correcting errors identified by Senior staff Communicate regularly with our clients, government agencies and other staff members. How do we define success for your role? You demonstrate BDO's core values through all aspect of your work: Integrity, Respect and Collaboration You understand your client’s industry, challenges, and opportunities; clients describe you as positive, professional, and delivering high quality work You identify, recommend, and are focused on effective service delivery to your clients You share in an inclusive and engaging work environment that develops, retains & attracts talent You actively participate in the adoption of digital tools and strategies to drive an innovative workplace You grow your expertise through learning and professional development. Y our experience and education You have a minimum of 2 years of hands on, in depth bookkeeping experience. Bilingualism (English and French); due to the frequent and complex contact with our English-speaking partners and clients in Quebec and outside of Quebec, and the need to draft documents in English, knowledge of English is essential for this position. A post-secondary education in Accounting or Finance is considered and Asset. You have proficiency in Microsoft Office computer programs (Outlook, Excel and Word). Experience using software such as QuickBooks Online, Acomba and Sage 50 or similar operating systems is an asset. Why BDO? Our people-first approach to talent has earned us a spot among Canada’s Top 100 Employers for 2025 . This recognition is a milestone we’re thrilled to add to our collection of awards for both experienced and student talent experiences. Our firm is committed to providing an environment where you can be successful in the following ways: We enable you to engage with how we change and evolve, being a key contributor to the success and growth of BDO in Canada. We help you become a better professional within our services, industries, and markets with extensive opportunities for learning and development. We support your achievement of personal goals outside of the office and making an impact on your community. Giving back adds up: Where company meets community. BDO is actively involved in our communities by supporting local charity initiatives. We support staff with local and national events where you will be given the opportunity to contribute to your community. Total rewards that matter: We pay for performance with competitive total cash compensation that recognizes and rewards your contribution. We provide flexible benefits from day one, and a market leading personal time off policy. We are committed to supporting your overall wellness beyond working hours and provide reimbursement for wellness initiatives that fit your lifestyle. Everyone counts: We believe every employee should have the opportunity to participate and succeed. Through leadership by our Diversity, Equity and Inclusion Leader , we are committed to a workplace culture of respect, inclusion, and diversity. We recognize and celebrate the valuable differences among each of us, including race, religious beliefs, physical or mental disabilities, age, place of origin, marital status, family status, gender or gender identity and sexual orientation. If you require accommodation to complete the application process, please contact us . Flexibility: All BDO personnel are expected to spend some of their time working in the office, at the client site, and virtually unless accommodations or alternative work arrangements are in place. Our model is a blended approach designed to support the flexible needs of our people, the firm and our clients. It’s about creating work experiences that meet everyone’s needs and providing flexibility to adjust when, where and how we work to meet the expectations of our role. Code of Conduct : Our Code of Conduct sets clear standards for how we conduct business. It reflects our shared values and commitments and includes guiding principles to help us make ethical decisions and maintain trust with each other, our clients, and the public. Ready to make your mark at BDO? Click “Apply now” to send your up-to-date resume to one of our Talent Acquisition Specialists. To explore other opportunities at BDO, check out our careers page . #LI-JD1"
BDO Canada ,https://bdo.wd3.myworkdayjobs.com/en-US/BDO/job/Oakville/Technical-Architect--Dynamics-365-CRM-D365-CE_JR4227,"Technical Architect, Dynamics 365 CRM/D365 CE (Hybrid)","Oakville, Edmonton - 103 St, Halifax - Mumford Rd, Toronto - Bay St",Full time,"Putting people first, every day BDO is a firm built on a foundation of positive relationships with our people and our clients. Each day, our professionals provide exceptional service, helping clients with advice and insight they can trust. In turn, we offer an award-winning environment that fosters a people-first culture with a high priority on your personal and professional growth. Your Opportunity BDO Digital is looking for a full-time permanent Microsoft Dynamics 365 CRM / D365 CE Technical Architect to join our growing team. The individual can work on a hybrid work model from one of our Oakville, Toronto, Halifax or Edmonton offices and will own the following responsibilities: Lead the design and architecture of end-to-end solutions for Microsoft Dynamics 365 CE, ensuring scalability, security, and performance. Develop and enforce architectural best practices and guidelines for CRM implementations. Collaborate with business stakeholders, project managers, and development teams to define requirements and system architecture. Provide technical leadership and mentorship to development teams, ensuring adherence to best practices and architectural principles. Evaluate new technologies, tools, and frameworks to improve the architecture and performance of Microsoft Dynamics 365 CE solutions. Define integration strategies with other enterprise systems using APIs, middleware, and cloud technologies. Oversee DevOps automation, including CI/CD pipelines, testing, and deployment strategies. Troubleshoot and resolve architectural and performance issues, providing recommendations for optimization. Ensure software documentation and reporting align with best practices and compliance standards. How do we define success for your role? You will understand the industries BDO services and contribute to the group's advancement. You will ensure work is complete, accurate, and appropriately reviewed by maintaining the necessary technical knowledge and professional development. You will recommend and implement quality or efficiency improvements to our engagements. You will actively engage in communication with people leaders to ensure understanding of performance and development while identifying and attracting top talent. You will support our firm's revenue growth by referring clients to other service lines and new clients to BDO. Your experience and education Must have 7+ years of experience working in Microsoft Dynamics 365 (CRM/CE) architecture and development. Strong experience in defining and implementing enterprise-level architecture for Microsoft Dynamics 365 CE. Expertise in designing integrations with Azure services, APIs, middleware, and other enterprise applications. Experience leading technical teams, mentoring developers, and conducting peer code reviews. Deep understanding of Microsoft Power Platform, Power Automate, Power Apps, and Dataverse. Experience with ASP.Net MVC, API application development (C#), and front-end technologies (HTML, CSS, JavaScript). Strong knowledge of Plug-in development (C#), Dynamics CRM SDK, and Portal development. Experience in DevOps automation, CI/CD pipelines, and cloud-based deployments (Azure DevOps, GitHub Actions, etc.). Excellent communication and ability to translate complex technical concepts into business language for stakeholders. Why BDO? Our people-first approach to talent has earned us a spot among Canada’s Top 100 Employers for 2025 . This recognition is a milestone we’re thrilled to add to our collection of awards for both experienced and student talent experiences. Our firm is committed to providing an environment where you can be successful in the following ways: We enable you to engage with how we change and evolve, being a key contributor to the success and growth of BDO in Canada. We help you become a better professional within our services, industries, and markets with extensive opportunities for learning and development. We support your achievement of personal goals outside of the office and making an impact on your community. Giving back adds up: Where company meets community. BDO is actively involved in our communities by supporting local charity initiatives. We support staff with local and national events where you will be given the opportunity to contribute to your community. Total rewards that matter: We pay for performance with competitive total cash compensation that recognizes and rewards your contribution. We provide flexible benefits from day one, and a market leading personal time off policy. We are committed to supporting your overall wellness beyond working hours and provide reimbursement for wellness initiatives that fit your lifestyle. Everyone counts: We believe every employee should have the opportunity to participate and succeed. Through leadership by our Diversity, Equity and Inclusion Leader, we are committed to a workplace culture of respect, inclusion, and diversity. We recognize and celebrate the valuable differences among each of us, including race, religious beliefs, physical or mental disabilities, age, place of origin, marital status, family status, gender or gender identity and sexual orientation. If you require accommodation to complete the application process, please contact us . Flexibility: All BDO personnel are expected to spend some of their time working in the office, at the client site, and virtually unless accommodations or alternative work arrangements are in place. Our model is a blended approach designed to support the flexible needs of our people, the firm and our clients. It’s about creating work experiences that meet everyone’s needs and providing flexibility to adjust when, where and how we work to meet the expectations of our role. Code of Conduct: Our Code of Conduct sets clear standards for how we conduct business. It reflects our shared values and commitments and includes guiding principles to help us make ethical decisions and maintain trust with each other, our clients, and the public. Ready to make your mark at BDO? Click “Apply now” to send your up-to-date resume to one of our Talent Acquisition Specialists. To explore other opportunities at BDO, check out our careers page . #LI-SA3"
BDO Canada ,https://bdo.wd3.myworkdayjobs.com/en-US/BDO/job/Oakville/Senior-Functional-Consultant--D365-Customer-Experience_JR4226,"Senior Functional Consultant, D365 Customer Experience (Hybrid)","Oakville, Edmonton - 103 St, Halifax - Mumford Rd, Toronto - Bay St",Full time,"Putting people first, every day BDO is a firm built on a foundation of positive relationships with our people and our clients. Each day, our professionals provide exceptional service, helping clients with advice and insight they can trust. In turn, we offer an award-winning environment that fosters a people-first culture with a high priority on your personal and professional growth. Your Opportunity BDO Digital is currently seeking a Microsoft Dynamics CE Senior Consultant to join our growing Dynamics CRM/D365 CE Practice, with the ability to work hybrid from our offices in Toronto, Oakville, Halifax or Edmonton. The Senior Consultant will be responsible for supporting all application activities during the full lifecycle of a Dynamics 365 CRM/CE implementation. This includes working with the BDO Digital team on various activities including requirements gathering and documentation, business process definition, solution design, configuration, testing, user training and support on a variety of projects. Key Responsibilities: Conduct planning sessions to identify and document client requirements Design and architect end-to-end Dynamics 365 CRM/CE solutions that align with client business objectives Lead and mentor junior consultants by providing guidance on solution configuration and ensuring detailed design documentation Support sales opportunities by contributing to solution demonstrations, proposals, and discussions with prospective clients Configure Dynamics 365 CE solutions to meet defined requirements Perform solution testing and documentation Provide user training and develop related training documentation Deliver on-site and remote client support Liaise directly with client stakeholders to understand business processes and requirements Collaborate with technical team members to define best-in-class solutions Assist project management in delivering on-time, on-budget deployments Guide clients in transforming their organizations through technology adoption and best practices How do we define success for your role? You demonstrate BDO's core values through all aspect of your work: Integrity, Respect and Collaboration You understand your client’s industry, challenges, and opportunities; clients describe you as positive, professional, and delivering high quality work You identify, recommend, and are focused on effective service delivery to your clients You share in an inclusive and engaging work environment that develops, retains & attracts talent You actively participate in the adoption of digital tools and strategies to drive an innovative workplace You grow your expertise through learning and professional development. Your experience and education Required: Demonstrable practical experience working with CRM software (preferably Dynamics) is a requirement for this position.  This could include previous experience as a Dynamics CE/CRM consultant or a role as internal CRM support. Knowledge of Dynamics 2016/365 CRM, and the O365 platform as it pertains to feature sets that integrate with Dynamics CRM solutions, including SharePoint and OneDrive/OneNote Excellent communication and interpretive skills. Communicating with clients and interpreting their needs will be a daily activity. Perform as a committed team player.  The success on each project depends on the combined efforts of the implementation team. Highly organized and able to work well under pressure both from clients and from team members. Flexible and adaptable to change. We implement change for diverse clients on a daily basis. Self-motivated. Learning new skills without prompting is expected. Beneficial: The following certifications are desirable (related certifications also considered): Microsoft Dynamics 365 for Sales Microsoft Dynamics 365 for Customer Service Professional Services Experience Experience working with clients to determine their requirements and business processes and map them to the capabilities of Dynamics 365 CRM Experience designing and documenting customizations required in the solution to meet client’s needs University Degree or College Diploma in technology or business Previous consulting experience preferred but not required. Why BDO? Our people-first approach to talent has earned us a spot among Canada’s Top 100 Employers for 2025 . This recognition is a milestone we’re thrilled to add to our collection of awards for both experienced and student talent experiences. Our firm is committed to providing an environment where you can be successful in the following ways: We enable you to engage with how we change and evolve, being a key contributor to the success and growth of BDO in Canada. We help you become a better professional within our services, industries, and markets with extensive opportunities for learning and development. We support your achievement of personal goals outside of the office and making an impact on your community. Giving back adds up: Where company meets community. BDO is actively involved in our communities by supporting local charity initiatives. We support staff with local and national events where you will be given the opportunity to contribute to your community. Total rewards that matter: We pay for performance with competitive total cash compensation that recognizes and rewards your contribution. We provide flexible benefits from day one, and a market leading personal time off policy. We are committed to supporting your overall wellness beyond working hours and provide reimbursement for wellness initiatives that fit your lifestyle. Everyone counts: We believe every employee should have the opportunity to participate and succeed. Through leadership by our Diversity, Equity and Inclusion Leader, we are committed to a workplace culture of respect, inclusion, and diversity. We recognize and celebrate the valuable differences among each of us, including race, religious beliefs, physical or mental disabilities, age, place of origin, marital status, family status, gender or gender identity and sexual orientation. If you require accommodation to complete the application process, please contact us . Flexibility: All BDO personnel are expected to spend some of their time working in the office, at the client site, and virtually unless accommodations or alternative work arrangements are in place. Our model is a blended approach designed to support the flexible needs of our people, the firm and our clients. It’s about creating work experiences that meet everyone’s needs and providing flexibility to adjust when, where and how we work to meet the expectations of our role. Code of Conduct: Our Code of Conduct sets clear standards for how we conduct business. It reflects our shared values and commitments and includes guiding principles to help us make ethical decisions and maintain trust with each other, our clients, and the public. Ready to make your mark at BDO? Click “Apply now” to send your up-to-date resume to one of our Talent Acquisition Specialists. To explore other opportunities at BDO, check out our careers page . #LI-SA2"
